capability_id,title,requirement,source_refs,source_wording,mandatory_requirement,verification_gate,coverage_work_order_refs,coverage_reference_refs,coverage_boundary,planning_evidence,local_status,product_complete
CAP-MIG-023,Checkout-bound issue integration,mandatory,reference-package:specs/github-issues-index.md:L1-L9,"[""# GitHub issues index\n\nUse these issue prompts additively:\n\n- `prompts/ISSUE_ENVCTL.md`\n- `prompts/ISSUE_NU_PLUGIN.md`\n- `prompts/ISSUE_SHARED_PROTOCOL.md`\n\nCodex should adapt issue text with actual repo file paths, existing issue numbers if found, and implementation evidence from the current local checkout.""]","Bind issue and PR work to actual checkout paths, discovered issue/PR identifiers, and checkout evidence rather than placeholder repository assumptions.","Integration validation must reject missing checkout receipts, invented identifiers, stale paths, and issue/PR evidence not tied to the inspected revision.",TASK-CDB048,,"CDB048 anchors the requirement, but actual issue/PR integration and checkout evidence are an explicit companion review gap.",,review,false
CAP-MIG-024,Deterministic seed identity,mandatory,reference-package:sql/003_seed_artifact_contract.sql:L1-L12,"[""-- Seed intent for artifact contract import.\n-- Codex should generate concrete INSERTs only after it computes real IDs/hashes from the bundled package.\n\n-- Required contract name:\n-- full-migration-artifact-contract\n\n-- Required initial package fixture:\n-- codex-flexnetos-migration-prompt-package\n\n-- Required artifacts include all entries from:\n-- source/codex-flexnetos-migration-prompt-package/expected-output/migration-artifacts-tree.md\n-- source/previous-migration-artifact-context.md""]",Generate seed records deterministically from bound source IDs and digests and reject invented literal identities.,"Regeneration must be byte-stable for the same inputs and fail on unbound IDs, missing digests, or hand-authored placeholder literals.",TASK-CDB005;TASK-CDB014;TASK-CDB015;TASK-CDB016;TASK-CDB047;TASK-CDB055;TASK-CDB090,,Planning coverage is mapped; product implementation and verification remain review-gated.,,review,false
CAP-MIG-025,Database-owned artifact truth,mandatory,reference-package:specs/envctl-db-automation-architecture.md:L25-L31,"[""## Source of truth\n\nenvctl database owns durable state. Files may hold exported artifacts, but the DB records their identity, hashes, links, and status.\n\n## Package adapter\n\nExternal prompt packages are imported as versioned packages. Execution becomes operations/events; output becomes artifacts/evidence records.""]","Treat files as projections while the database owns artifact identity, digest, links, and status.","Reconciliation tests must prove files derive from database records and cannot independently mutate identity, digest, link, or status truth.",TASK-CDB015;TASK-CDB016;TASK-CDB017;TASK-CDB018;TASK-CDB035;TASK-CDB063;TASK-CDB072;TASK-CDB076;TASK-CDB102,,Planning coverage is mapped; product implementation and verification remain review-gated.,,review,false
CAP-MIG-026,Persistent navigable migration memory,mandatory,reference-package:source/codex-flexnetos-migration-prompt-package/README.md:L73-L73,"[""The run should create or update a `migration-artifacts/` folder inside the selected repository/workspace and generate a persistent artifact memory file.""]","Maintain a navigation graph, artifact index, persistent migration memory, and receipted update path for every material change.",Navigation tests must find every artifact bidirectionally and require a deterministic update receipt whenever memory or index state changes.,TASK-CDB001;TASK-CDB004;TASK-CDB005;TASK-CDB047;TASK-CDB048,,Planning coverage is mapped; product implementation and verification remain review-gated.,,review,false
CAP-MIG-027,Incremental watch fallback and inotify resilience,mandatory,reference-package:execution-framework/generated/issue-414/task_graph.csv:L9-L9,"[""REQ-057_WATCH_INCREMENTAL,GH-414,05-envctl-db-upgrade,Incremental index invalidation (watch),envctl db watch --repo-root: notify-based incremental index invalidation with poll fallback and inotify-limit awareness,lane_b_repo_a,envctl-db-upgrade-agent,helper-req-057_watch_incremental,gpt-5.3-spark,codex-cli-background-shell,workspace-write,repo_a,${ENVCTL_REPO},repo,prompts/ISSUE_ENVCTL.md|specs/envctl-nu-plugin-boundary.md|GH-issue-414|crates/engine/src/db_index.rs,crates/engine/src/db_index.rs|crates/cli/src/main.rs,envctl db watch command,${ENVCTL_REPO}/**|${NU_PLUGIN_REPO}/**|execution-framework/**,**/.env|**/secrets/**|**/private_keys/**|**/*.pem|**/*.key,REQ-052_FILE_INDEX,,db_upgrade_watch,true,2,,140,pending,05-envctl-db-upgrade,codex|python3|shell|cargo,codex exec < generated/issue-414/execution_packets/REQ-057_WATCH_INCREMENTAL.json,cargo test -p envctl-engine db_watch,watch invalidates only changed file rows; poll fallback documented,true,execution-framework/proof_records/REQ-057_WATCH_INCREMENTAL.proof.json,execution-framework/heartbeats/REQ-057_WATCH_INCREMENTAL.heartbeat,execution-framework/logs/REQ-057_WATCH_INCREMENTAL.log,git restore + envctl catalog sync --dry-run (fail-closed; exports write new trees),R2,false,Optional/poll fallback where useful; large-dir/inotify limits handled.""]",Provide notify-based incremental invalidation with a polling fallback and explicit large-directory and inotify-limit behavior.,"Watcher tests must prove changed-file-only invalidation, forced polling fallback, inotify-limit recovery, bounded resource use, and stable agent-visible status.",,reference-issue-414:REQ-057_WATCH_INCREMENTAL,"The source issue task is retained in its provenance namespace; this mandatory mapping does not promote its status, proof, or agent approval into LifeOS completion.",,review,false
CAP-MIG-028,Tier-4 parser and indexer boundary,mandatory,task-tables:raw/POLYGLOT_TASK_GRAPH.csv:L6-L6,"[""CDB095,Add Tree-sitter/ast-grep parser-backed summary prototype,planning,complete,CDB091,docs/polyglot-import/parser-and-indexer-tooling-matrix.md,parser/indexer candidates and bounded summary plan documented,no external CLI mandatory for default tests,Defines Tier 2 and optional Tier 4 boundary""]","Define and verify both the Tier-2 parser-backed summary and the Tier-4 parser/indexer boundary; Tier 4 is mandatory planning scope, never a deferred option.","TASK-CDB095 review evidence must identify Tier-2 and Tier-4 contracts, supported and rejected operations, parser/version provenance, bounded output, and deterministic verification fixtures.",TASK-CDB095,,TASK-CDB095 is still review-only and requires an actual human decision plus new LifeOS-local proof before execution or completion.,,review,false
