capability_id,title,requirement,source_refs,source_wording,mandatory_requirement,verification_gate,coverage_work_order_refs,coverage_reference_refs,coverage_boundary,planning_evidence,local_status,product_complete
CAP-MIG-001,Structured human involvement modes,mandatory,reference-package:prompts/MASTER_PROMPT_ENVCTL_DB_NU_PLUGIN.md:L5-L5;reference-package:source/current-user-request.md:L5-L5,"[""Your mission is to upgrade the local `envctl` database tooling and the connected `nu_plugin` repository so migration execution becomes a built-in, reproducible, agent-controllable database capability with live human visuals and optional human involvement."",""Goal: envctl database should provide built-in migration database tooling controllable by CLI agents. Human users should have live visuals and may choose active involvement or passive supervision. envctl database must be able to reproduce the migration operation anytime, making the migration design faster, more secure, more accurate, and repeatable. The package must be additive to current Codex prompts intended for envctl and nu_plugin GitHub issues.""]","Model observer, approval-gated, operator, and agent-only as structured modes with explicit authority and transition rules.",Schema and behavior tests must cover all four modes and prove that mode changes cannot bypass approval or risk policy.,TASK-CDB030;TASK-CDB075;TASK-CDB089,,Planning coverage is mapped; product implementation and verification remain review-gated.,,review,false
CAP-MIG-002,Required runtime inputs and resolved-path receipts,mandatory,reference-package:prompts/MASTER_PROMPT_ENVCTL_DB_NU_PLUGIN.md:L7-L19;reference-package:RUN_WITH_CODEX_ENVCTL.sh:L16-L18,"[""## Input variables\n\nThe runner may provide:\n\n```text\nRUN_CONTEXT_FILE=<path>\nPROMPT_PACKAGE_DIR=<path>\nENVCTL_REPO=<path>\nNU_PLUGIN_REPO=<path>\nFLEXNETOS_PACKAGE=<path>\n```\n\nRead the run context first. Resolve all paths with `realpath` and record the resolved paths in a working note inside the envctl repo."",""Optional:\n  --flexnetos-package Path to prior codex-flexnetos-migration-prompt-package.\n  --codex-bin         Codex executable name/path. Default: codex.""]","Require the run-context, package, envctl, nu_plugin, and target inputs applicable to a run; resolve each path and persist a resolved-path receipt.","Missing required inputs, unresolved paths, and path/receipt mismatches must fail closed before planning or execution.",TASK-CDB000;TASK-CDB036;TASK-CDB039,,Planning coverage is mapped; product implementation and verification remain review-gated.,,review,false
CAP-MIG-003,Generic target descriptor and recipe,mandatory,reference-package:prompts/UTILIZE_FLEXNETOS_PACKAGE.md:L67-L75,"[""## Genericization requirement\n\nDo not bake FlexNetOS into envctl. FlexNetOS should be one target descriptor and one package fixture. The same envctl machinery must run against any target with:\n\n- descriptor\n- recipe\n- artifact contract\n- safety policy\n- scanner capability map""]","Drive every target through a descriptor, recipe, artifact contract, safety policy, scanner capability map, and output policy without target-specific execution branches.",A non-FlexNetOS fixture must traverse the same planner and packet path without conditional target-name logic.,TASK-CDB035;TASK-CDB036;TASK-CDB091;TASK-CDB092;TASK-CDB093;TASK-CDB094;TASK-CDB095;TASK-CDB096;TASK-CDB097;TASK-CDB098;TASK-CDB099;TASK-CDB100;TASK-CDB101;TASK-CDB102;TASK-CDB103;TASK-CDB104;TASK-CDB105,,Planning coverage is mapped; product implementation and verification remain review-gated.,,review,false
CAP-MIG-004,Canonical replay modes,mandatory,reference-package:prompts/DATABASE_FEATURE_SPEC.md:L101-L101;reference-package:prompts/SECURITY_REPRODUCIBILITY_MODEL.md:L32-L39,"[""Replay may be `verify-only`, `dry-run-plan`, or `execute-again`. Destructive replay requires explicit approval."",""## Replay modes\n\n| Mode | Behavior |\n|---|---|\n| `verify-only` | Recompute hashes and confirm artifacts/evidence still match. |\n| `dry-run-plan` | Reconstruct operation plan without executing target-affecting commands. |\n| `execute-safe` | Re-run R0-R2 operations. |\n| `execute-full` | Requires explicit approval for R3+. |""]","Reconcile replay terminology to verify-only, dry-run-plan, execute-safe, and approval-gated-full with explicit destructive-operation approval.","Protocol and CLI tests must accept only the canonical modes, map legacy wording explicitly, and prove full replay remains approval gated.",TASK-CDB072;TASK-CDB073;TASK-CDB074;TASK-CDB075;TASK-CDB076;TASK-CDB087;TASK-CDB088;TASK-CDB089;TASK-CDB090;TASK-CDB102,,Planning coverage is mapped; product implementation and verification remain review-gated.,,review,false
CAP-MIG-005,Actor authority and R0-R5 policy,mandatory,reference-package:prompts/DATABASE_FEATURE_SPEC.md:L103-L105;reference-package:prompts/AGENT_CONTROL_PROTOCOL.md:L7-L38,"[""## Agent control\n\nAgents may create plans, execute safe read-only operations, synthesize artifacts, run validations, and request approvals. Agents may not silently perform destructive operations, mutate production targets, or bypass safety policy."",""## Actors\n\n```text\nsystem      envctl internal scheduler/runner\nagent       Codex or other automation agent\nhuman       shell user/operator\nplugin      nu_plugin session acting on behalf of a human\nexternal    imported package/helper process\n```\n\n## Authority levels\n\n```text\nread_only          can inspect targets, events, artifacts, and plans\nsafe_execute       can run read-only scanners and artifact generation\napproval_request  can request approval for risky operations\noperator           can approve, deny, pause, resume, or rollback\nadmin              can alter policies/contracts/schemas\n```\n\n## Operation risk classes\n\n```text\nR0 read-only inspection\nR1 writes only to envctl artifact/evidence store\nR2 modifies local working copy artifacts\nR3 modifies target repository code/config\nR4 modifies databases/infrastructure/secrets\nR5 destructive or production-impacting operation\n```\n\nR3+ requires explicit approval unless policy has a pre-approved scoped rule. R4/R5 must default to approval-gated.""]","Represent actors, authority levels, and R0-R5 risk classes as structured policy data enforced at every operation boundary.",Authorization tests must prove each actor/authority combination and require explicit approval for R3+ with fail-closed R4/R5 defaults.,TASK-CDB010;TASK-CDB033;TASK-CDB034;TASK-CDB075;TASK-CDB089;TASK-CDB104,,Planning coverage is mapped; product implementation and verification remain review-gated.,,review,false
CAP-MIG-006,Required plugin operational views,mandatory,reference-package:prompts/NU_PLUGIN_CONTRACT.md:L69-L82,"[""## Live visuals\n\nThe plugin should support:\n\n- status tables\n- timelines\n- operation queue views\n- approval queue views\n- artifact index views\n- graph edge views\n- validation scorecards\n- replay plan summaries\n\nVisuals must degrade gracefully in plain terminal mode.""]","Provide status, timeline, operations, approvals, artifacts, graph, validation, and replay views with a plain-terminal fallback.",Contract tests must exercise every view against authoritative records and verify graceful structured output without rich-terminal support.,TASK-CDB029;TASK-CDB030;TASK-CDB031;TASK-CDB032;TASK-CDB103,,Planning coverage is mapped; product implementation and verification remain review-gated.,,review,false
CAP-MIG-007,Conflict scope and operation leases,mandatory,reference-package:prompts/AGENT_CONTROL_PROTOCOL.md:L47-L54,"[""\n```text\nrun_id + operation_type + target_descriptor_hash + recipe_step_id + input_hash\n```\n\n## Concurrency\n\nMultiple agents may work in parallel only if operations have non-conflicting target scopes or the database obtains a lease/lock. Locks must be visible in live status.""]","Define operation conflict scopes and enforce atomic leases with owner, acquisition, expiry, renewal, release, and live visibility semantics.","Concurrency tests must reject conflicting operations, permit non-conflicting scopes, handle expiry/renewal atomically, and expose the active owner.",TASK-CDB016;TASK-CDB061,,Task-level lease primitives exist in this handoff; the required operation-level lease model remains a companion review gap and is not product-complete.,control/lease_registry.json;import-nu-plugin-task-tables.mjs#acquireTaskLease,review,false
CAP-MIG-008,Source-bound projections,mandatory,reference-package:prompts/LIVE_VISUALS_AND_HUMAN_CONTROL.md:L28-L30,"[""## Visual correctness rule\n\nThe plugin may format and summarize, but every visual must derive from envctl database records. No plugin-only inferred state should be treated as truth.""]",Every projection must carry authoritative source identifiers and digests; inferred display state must never become migration truth.,Projection tests must trace every row to source IDs/hashes and reject rows lacking an authoritative record.,TASK-CDB018;TASK-CDB035;TASK-CDB055;TASK-CDB063;TASK-CDB085;TASK-CDB089,,Planning coverage is mapped; product implementation and verification remain review-gated.,,review,false
CAP-MIG-009,Required rich visual surfaces,mandatory,reference-package:prompts/LIVE_VISUALS_AND_HUMAN_CONTROL.md:L45-L51;task-tables:raw/REQUIREMENT_PROOF_LEDGER.csv:L97-L97,"[""## Optional richer visuals\n\n- Mermaid graph export.\n- DOT graph export.\n- TUI dashboard if existing repo supports it.\n- Streaming event subscription if existing architecture supports it.\n- Static HTML/wiki export if existing artifact tooling supports it."",""REQ-061-ARCH11,REQ-061,Expose agent-first roots refs refactor hooks widgets and optional gated TUI,https://github.com/FlexNetOS/envctl/issues/414,Architecture section 9,../envctl/crates/engine/**,../envctl/crates/engine/tests/**,cargo test --manifest-path ../envctl/Cargo.toml --workspace,stdout:req-061-arch11-stdout;stderr:req-061-arch11-stderr,,verified,complete,\""Schema-4 detached proof binds this exact command to pinned FlexNetOS/envctl b62669c4e32c8de0407aa51ca3add94d529b50b6 and pinned loop_lib/meta_plugin_protocol dependencies; execution must pass without mutating any checkout.\""""]","Provide Mermaid, Graphviz DOT, TUI dashboard, live event stream, static HTML, and static wiki projections as required surfaces.","All six projections must be deterministic, receipted, canonical-record-derived, and coverage-equivalent for task and status identity.",TASK-CDB001;TASK-CDB030;TASK-CDB103,nu-plugin-requirement:REQ-061-ARCH11,All six surfaces are implemented as deterministic planning projections; runtime product wiring and acceptance remain review-gated.,visuals/task_graph.mmd;visuals/task_graph.dot;visuals/dashboard.txt;visuals/event_stream.ndjson;visuals/task_graph.html;visuals/task_graph.wiki.md,review,false
CAP-MIG-010,Nullable compare-root state,mandatory,reference-package:prompts/ANY_TARGET_EXTENSION_SPEC.md:L7-L13,"[""```yaml\nschema_version: 1\ntarget_id: stable-human-readable-id\ntarget_type: codebase | data | infrastructure | integration | mixed\nprimary_root: /absolute/or/repo-relative/path\ncompare_root: /optional/path\noutput_root: migration-artifacts""]","Represent compare_root as nullable with explicit absent, resolved, and path-receipt state rather than an invented path.","Descriptor tests must distinguish absent from resolved values and reject unresolved, unreceipted, or escaped compare roots.",TASK-CDB036;TASK-CDB070;TASK-CDB091,,Planning coverage is mapped; product implementation and verification remain review-gated.,,review,false
CAP-MIG-011,Redaction before persistence,mandatory,reference-package:prompts/SECURITY_REPRODUCIBILITY_MODEL.md:L3-L13,"[""## Security requirements\n\n- Redact secrets before artifact persistence.\n- Store command strings in redacted form when they may contain credentials.\n- Store raw evidence only in approved evidence locations.\n- Mark evidence as redacted/unredacted.\n- Hash every evidence file and generated artifact.\n- Approval-gate risky operations.\n- Never bypass sandbox/approval controls.\n- Keep plugin mutating commands auditable.\n- Prevent agents from writing directly to production targets without policy.""]","Redact credentials and secret material before persisting commands, events, evidence, artifacts, logs, or receipts while recording redaction state.",Secret-fixture tests must prove raw values never reach durable output and that redaction metadata and hashes remain verifiable.,TASK-CDB010;TASK-CDB043;TASK-CDB060;TASK-CDB104,,Planning coverage is mapped; product implementation and verification remain review-gated.,,review,false
CAP-MIG-012,Canonical hash-chained events,mandatory,reference-package:prompts/SECURITY_REPRODUCIBILITY_MODEL.md:L41-L47,"[""## Chain integrity\n\nRun events should be chained:\n\n```text\nevent_hash = sha256(previous_event_hash + canonical_event_json)\n```""]",Persist events in a canonical SHA-256 chain binding each canonical event to the preceding event hash.,"Chain verification and tamper tests must pass for intact ledgers and fail after payload, order, previous-hash, or digest mutation.",TASK-CDB004;TASK-CDB055;TASK-CDB085;TASK-CDB089,,The handoff event chain is implemented and validated locally; the envctl runtime chain and destructive tamper suite remain review-gated product work.,ledgers/events.jsonl;ledgers/ledger_manifest.json,review,false
CAP-MIG-013,Fail-closed completion proof,mandatory,reference-package:prompts/ACCEPTANCE_CRITERIA.md:L1-L19,"[""# Acceptance criteria\n\nCodex may only claim completion when all applicable criteria pass or are explicitly marked blocked with evidence.\n\n## envctl criteria\n\n- [ ] A target descriptor can be parsed and validated.\n- [ ] The prior FlexNetOS package can be inspected/imported as a package/artifact contract.\n- [ ] A migration recipe can be created from contract phases.\n- [ ] A migration run can be created in the database.\n- [ ] Operations append events.\n- [ ] Evidence records include path/URI, kind, hash, redaction status, and operation link.\n- [ ] Artifact records include artifact ID, status, hash, path, evidence, and links.\n- [ ] Approval requests block risky operations.\n- [ ] Approval decisions are appended as events.\n- [ ] Validation results are queryable.\n- [ ] Replay can reconstruct or verify a run.\n- [ ] Rollback metadata exists for operations that need rollback.\n- [ ] Tests cover the above.""]","Completion requires a proof record, executed verification command, passing output, and bound digest; partial, planned, not_run, unapplied, or evidence-free claims must not complete.",Negative tests must reject every incomplete evidence state and digest mismatch; only a fully bound passing proof may transition local status.,TASK-CDB002;TASK-CDB028;TASK-CDB039;TASK-CDB046;TASK-CDB064;TASK-CDB065;TASK-CDB066;TASK-CDB067;TASK-CDB068;TASK-CDB069;TASK-CDB090;TASK-CDB102;TASK-CDB105,,Planning coverage is mapped; product implementation and verification remain review-gated.,,review,false
CAP-MIG-014,Dependency constraints and blocker evidence,mandatory,reference-package:source/previous-migration-artifact-context.md:L234-L234,"[""For a migration, this should include **version constraints** and **upgrade blockers**.""]","Capture dependency constraints, incompatibilities, upgrade blockers, and evidence references rather than dependency names alone.",Dependency validation must reject unresolved constraints/blockers and require evidence for every blocked edge.,TASK-CDB011;TASK-CDB021;TASK-CDB051;TASK-CDB065;TASK-CDB087,,Planning coverage is mapped; product implementation and verification remain review-gated.,,review,false
CAP-MIG-015,Artifact stage chain,mandatory,reference-package:source/previous-migration-artifact-context.md:L412-L435,"[""## The artifact hierarchy I would use\n\nFor a migration, artifacts should ladder from **discovery** to **execution**:\n\n```text\n1. Inventory\n   ↓\n2. Dependency Map\n   ↓\n3. Risk Map\n   ↓\n4. Target Design\n   ↓\n5. Migration Plan\n   ↓\n6. Validation Plan\n   ↓\n7. Cutover Plan\n   ↓\n8. Rollback Plan\n   ↓\n9. Operational Runbook\n   ↓\n10. Decommission Plan""]","Link inventory, dependency, risk, target, migration, validation, cutover, and rollback stages as an ordered evidence-bearing artifact chain.","Graph validation must prove every required stage exists in order, has traceable links, and cannot advance across a blocked predecessor.",TASK-CDB001;TASK-CDB002;TASK-CDB003;TASK-CDB004;TASK-CDB005;TASK-CDB006;TASK-CDB007;TASK-CDB008;TASK-CDB009;TASK-CDB010;TASK-CDB011;TASK-CDB012;TASK-CDB070;TASK-CDB071;TASK-CDB072;TASK-CDB073;TASK-CDB074;TASK-CDB075;TASK-CDB076;TASK-CDB077;TASK-CDB078;TASK-CDB079;TASK-CDB080;TASK-CDB081;TASK-CDB082;TASK-CDB083;TASK-CDB084;TASK-CDB085;TASK-CDB086;TASK-CDB087;TASK-CDB088;TASK-CDB089;TASK-CDB090,,Planning coverage is mapped; product implementation and verification remain review-gated.,,review,false
CAP-MIG-016,Blocked artifact evidence,mandatory,reference-package:source/codex-flexnetos-migration-prompt-package/prompts/EXECUTION_STYLE.md:L9-L15,"[""## Model verification\n\nBefore generating any migration finding, Codex must verify the active model/provider state. If `codex-5.4` or `spark-5.3` cannot be resolved by the local setup, Codex must create:\n\n- `migration-artifacts/00-executive-summary/model-resolution-blocker.md`\n\nand stop before creating factual analysis artifacts. It may still create empty scaffolding with `status: blocked`.""]",A blocked artifact must identify its blocker and evidence while remaining ineligible for completion claims.,Completion validation must reject blocked artifacts without blocker evidence and reject every blocked artifact presented as complete.,TASK-CDB002;TASK-CDB066;TASK-CDB069;TASK-CDB070,,Planning coverage is mapped; product implementation and verification remain review-gated.,,review,false
CAP-MIG-017,Unknown or partial artifacts never complete,mandatory,reference-package:source/codex-flexnetos-migration-prompt-package/expected-output/migration-artifacts-tree.md:L1-L3,"[""# Expected Migration Artifact Tree\n\nCodex must create this tree under the selected repository/workspace. Files may contain `status: unknown` or `status: partial` when evidence is insufficient, but the files must exist and must be linked from `index.md`.""]",Artifact existence and navigation links are required but unknown or partial artifacts remain non-terminal and cannot satisfy completion.,Status tests must keep linked unknown/partial artifacts incomplete until evidence-backed validation passes.,TASK-CDB001;TASK-CDB005;TASK-CDB066;TASK-CDB070,,Planning coverage is mapped; product implementation and verification remain review-gated.,,review,false
CAP-MIG-018,Explicit envctl/nu_plugin boundary,mandatory,reference-package:specs/envctl-nu-plugin-boundary.md:L3-L16,"[""## Rule\n\n`nu_plugin` must not independently mutate migration truth. It either calls envctl CLI/API/library methods or uses sanctioned transaction APIs.\n\n## Boundary options Codex may choose after repo inspection\n\n1. Invoke envctl CLI and parse JSON output.\n2. Link a shared Rust crate used by envctl and plugin.\n3. Use local IPC/socket if envctl already has a daemon/service pattern.\n4. Use direct DB connection only if envctl already exposes safe transaction APIs and plugin authorization.\n\n## Recommended default\n\nStart with envctl JSON CLI/API boundary because it keeps ownership clear and avoids duplicating DB access logic in the plugin.""]","Select an explicit boundary enum: JSON CLI, shared crate, IPC, or authorized database transaction API, and record rationale plus tests.",Boundary tests must prove nu_plugin cannot mutate durable truth outside the selected authorized interface.,TASK-CDB009;TASK-CDB011;TASK-CDB030;TASK-CDB035;TASK-CDB063;TASK-CDB103,,Planning coverage is mapped; product implementation and verification remain review-gated.,,review,false
CAP-MIG-019,Fail-closed filesystem policy,mandatory,reference-package:execution-framework/docs/FILESYSTEM_BOUNDARIES.md:L42-L50,"[""## Helper Rules\n\n- Blocked patterns take precedence over allowed paths.\n- Background helpers must not read or write paths that match blocked_paths.\n- Background helpers may read and write only paths that match allowed_paths and do not match blocked_paths.\n- ENVCTL_REPO and NU_PLUGIN_REPO are operator-provided roots; if unset, helpers must treat those lanes as unavailable.\n- Helper scratch writes must use execution-framework/state/helpers/${HELPER_ID}/ unless the task packet names a narrower output path.\n- Logs and proof evidence must be redacted using helpers/redaction_patterns.txt before capture.\n- Symlink traversal must be evaluated against the final resolved path and denied when it escapes the matched allowed root.""]","Apply blocked-first allow/deny evaluation to final resolved paths, deny symlink escapes, and fail closed on unmatched paths.","Path-policy tests must cover blocked precedence, allow matches, unmatched denial, traversal, symlink escape, and all WorkOrder path fields.",TASK-CDB010;TASK-CDB018;TASK-CDB028;TASK-CDB032;TASK-CDB033;TASK-CDB034;TASK-CDB043;TASK-CDB044;TASK-CDB045;TASK-CDB057;TASK-CDB083;TASK-CDB104,,Named WorkOrders anchor the policy and all 106 WorkOrder path fields are in scope; product enforcement remains review-gated.,,review,false
CAP-MIG-020,Protocol semantic-version compatibility,mandatory,reference-package:execution-framework/docs/SHARED_PROTOCOL_SCHEMAS.md:L7-L13,"[""## Source Of Truth\n\nenvctl migration database owns durable state; nu_plugin renders records and submits auditable commands.\n\n## Compatibility Rule\n\nMinor versions may add optional fields; removals, type narrowing, and enum removal require a new major protocol version.""]","Enforce protocol semver with schema-diff, backward-compatibility, default-value, and nullability tests.","Compatibility tests must allow additive optional minor changes and reject removal, narrowing, enum deletion, and incompatible default/nullability changes without a major version.",TASK-CDB007;TASK-CDB009;TASK-CDB011;TASK-CDB014;TASK-CDB051;TASK-CDB065;TASK-CDB086;TASK-CDB092,,Planning coverage is mapped; product implementation and verification remain review-gated.,,review,false
CAP-MIG-021,Self-contained bounded execution packets,mandatory,reference-package:execution-framework/docs/GOAL_LOOP_PROTOCOL.md:L18-L25,"[""## Rules\n\n- A task is runnable only when all dependencies are complete.\n- Parallel groups must respect `can_run_parallel` and `max_parallel`.\n- Human approval tasks stop the loop until an approval proof appears.\n- No task can be considered complete without a proof record in `proof_records/proof_ledger.jsonl`.\n- Failed verification stops downstream tasks that depend on the failed node.\n- Execution packets are bounded; no packet should require rereading the full package.""]",Each execution packet must be self-contained and narrowly bounded so an executor does not reread or reinterpret the full package.,"Packet schema and fixture tests must prove required context, scope, dependencies, gates, verification, and rollback are present without package-wide inference.",TASK-CDB003;TASK-CDB039;TASK-CDB065;TASK-CDB068,,Planning coverage is mapped; product implementation and verification remain review-gated.,,review,false
CAP-MIG-022,Contract-first dependency DAG,mandatory,reference-package:README.md:L28-L40,"[""## Bottom-line strategy\n\nDo **contract-first parallel implementation**.\n\nDo not fully implement the FlexNetOS prompt package first as a one-off, and do not build envctl tooling blindly without proving it can execute the package. Codex should:\n\n1. Extract and lock the migration artifact contract from the existing FlexNetOS package.\n2. Add envctl database tables, event sourcing, target descriptors, migration recipes, artifact contracts, evidence storage, approvals, checkpoints, rollbacks, replay, and validation records.\n3. Build a thin envctl adapter that can import and run the prior package as an external artifact-generation bundle.\n4. In parallel, build the Nushell plugin protocol/commands that read from and append controlled actions into envctl's migration database.\n5. Replace shell-oriented collectors with native envctl collectors incrementally, only after the adapter proves parity.\n\nThis sequencing avoids the two worst outcomes: a one-off migration package that cannot be reproduced, or a polished database tool that cannot execute the real migration contract.""]","Lock contracts and schemas first, construct their dependency DAG, then open only dependency-safe parallel implementation lanes.",Scheduler tests must block downstream lanes before contract/schema verification and permit only declared independent parallel groups afterward.,TASK-CDB000;TASK-CDB001;TASK-CDB002;TASK-CDB003;TASK-CDB004;TASK-CDB005;TASK-CDB006;TASK-CDB007;TASK-CDB008;TASK-CDB009;TASK-CDB010;TASK-CDB011;TASK-CDB012,,Planning coverage is mapped; product implementation and verification remain review-gated.,,review,false
