"task_id","parent_id","phase","title","owner_agent","goal","inputs","target_artifacts","allowed_paths","blocked_paths","simulation_required","execution_cell","verification_gate","rollback_plan","status","proof_uri","next_action"
"YZXCONV-001","LPS-003","0-foundation","Index and query all four Yazelix repositories","Code Intelligence Agent","Build fresh GitNexus indexes with PDG and derive repository ownership seams before planning runtime changes.","/home/flexnetos/meta/.meta.yaml; four Yazelix peer working trees","yazelix_runtime_convergence/EVIDENCE.md; four .gitnexus indexes","/home/flexnetos/meta/src/yazelix/.gitnexus/**; /home/flexnetos/meta/src/yazelix-helix/.gitnexus/**; /home/flexnetos/meta/src/yazelix-yazi-assets/.gitnexus/**; /home/flexnetos/meta/src/yazelix-terminal-support/.gitnexus/**; /home/flexnetos/meta/src/lifeos/planning-spine-v0/yazelix_runtime_convergence/**","tracked product-source mutation; profile mutation; generated Yazelix runtime mutation","FALSE","code-intelligence-cell","GitNexus status is up-to-date for all four repos and repo-qualified query/context calls return the recorded ownership seams.","Remove only the four disposable .gitnexus indexes and this baseline proof; tracked repository source remains unchanged.","Complete","proof_records/YZXCONV-001.proof.json","Ratify the target ownership contract in YZXCONV-002."
"YZXCONV-002","YZXCONV-001; YZXCONV-020","1-schema","Ratify one source-to-runtime ownership contract","Runtime Architecture Owner","Define exact editable-input, generated-output, runtime-state, profile, fleet, and peer boundaries before implementation.","yazelix_runtime_convergence/EVIDENCE.md; Yazelix ownership docs; Meta AGENTS.md; envctl AGENTS.md","approved ownership decision; path and command authority matrix","/home/flexnetos/meta/src/lifeos/planning-spine-v0/yazelix_runtime_convergence/**; /home/flexnetos/meta/src/yazelix/docs/contracts/**; /home/flexnetos/meta/src/envctl/docs/**","profile mutation; global config mutation; peer implementation code","FALSE","policy-cell","Owner approves the matrix in PLAN.md and every active path has exactly one editable owner, one generator, and one runtime consumer.","Revert the decision document and keep all current runtime selectors unchanged.","Ready","proof_records/YZXCONV-002.proof.json","Wait for the owner-authorized reconciliation and verification task YZXCONV-020."
"YZXCONV-003","YZXCONV-002","2-foundation","Converge to one active Nix/Yazelix profile closure","Yazelix Packaging Agent","Make ~/.nix-profile the sole interactive foundation selector and prevent the XDG profile from selecting a different closure or adding a second owner.","approved ownership decision; current two-profile receipt; staged Home Manager-in-foundation work","single-profile package contract; migration and rollback receipt","/home/flexnetos/meta/src/yazelix/flake.nix; /home/flexnetos/meta/src/yazelix/packaging/**; /home/flexnetos/meta/src/yazelix/home_manager/**; /home/flexnetos/.nix-profile*; /home/flexnetos/.local/state/nix/profiles/**","/nix/store mutation outside Nix; deleting profile generations without approval; hand-editing /home/flexnetos/.local/share/yazelix/**","TRUE","yazelix-nix-profile-cell","nix profile list shows one foundation element; ~/.nix-profile is the only PATH owner; any XDG selector resolves to the same closure or is inactive; yzx doctor reports one install owner.","Atomically restore the pre-change profile symlink recorded in the migration receipt and keep the prior generation reachable.","Draft","proof_records/YZXCONV-003.proof.json","Finish source package contracts, build without profile mutation, then request approval for cutover."
"YZXCONV-004","YZXCONV-002; YZXCONV-003","2-foundation","Converge Codex config authorship while preserving its real runtime home","Codex Runtime Agent","Keep the profile-owned Codex binary and ~/.codex runtime/state home while materializing config.toml and RULES.md from reviewed Yazelix-owned editable inputs and eliminating old-profile references.","Codex doctor receipt; approved input paths; Yazelix runtime model; /home/flexnetos/AGENTS.md RULES authority declaration","Codex config and RULES inputs; materializer; runtime provenance gate","/home/flexnetos/meta/src/yazelix/**; /home/flexnetos/meta/src/envctl/agent-env.yaml; /home/flexnetos/meta/src/envctl/agent-skills/**; /home/flexnetos/.config/yazelix/**; /home/flexnetos/.codex/config.toml; /home/flexnetos/.codex/RULES.md","/home/flexnetos/.codex/auth.json; /home/flexnetos/.codex/sessions/**; /home/flexnetos/.codex/*.sqlite*; retired workspace .codex mirrors; direct runtime-only RULES.md authorship without a reviewed Yazelix/envctl input","TRUE","codex-runtime-cell","codex doctor reports the profile executable, CODEX_HOME=/home/flexnetos/.codex, parseable generated config, materialized RULES.md checksumming to its reviewed editable input, and no path into an inactive profile or retired workspace mirror.","Restore prior config.toml and RULES.md projections from checksum-backed copies without moving auth, sessions, or databases.","Draft","proof_records/YZXCONV-004.proof.json","Implement the approved config and RULES materializer after YZXCONV-003 source proof."
"YZXCONV-005","YZXCONV-002; YZXCONV-003","2-foundation","Converge Claude settings authorship through the Yazelix/envctl chain","Claude Runtime Agent","Keep the profile-owned Claude binary and ~/.claude state home while replacing direct settings authorship with reviewed Yazelix input and envctl-compatible materialization.","Claude binary receipt; approved input path; envctl agent-env contract","Claude settings input; materializer; runtime provenance gate","/home/flexnetos/meta/src/yazelix/**; /home/flexnetos/meta/src/envctl/agent-env.yaml; /home/flexnetos/meta/src/envctl/agent-skills/**; /home/flexnetos/.config/yazelix/**; /home/flexnetos/.claude/settings.json","/home/flexnetos/.claude credentials; /home/flexnetos/.claude history and cache; retired workspace .claude mirrors","TRUE","claude-runtime-cell","Claude launches from the one profile, settings checksum back to the approved input, generated hooks contain no stale Bash-to-Nu wrapper, and state remains under ~/.claude.","Restore the previous settings.json from a checksum-backed copy without moving credentials or history.","Draft","proof_records/YZXCONV-005.proof.json","Implement beside YZXCONV-004 so both runtimes consume one ownership contract."
"YZXCONV-006","YZXCONV-002; YZXCONV-003","2-foundation","Package the native envctl agent-env binary in the single profile","envctl Packaging Agent","Expose the native envctl binary through Yazelix toolbin/bin and remove the generated /bin/sh Meta wrapper from the active interactive route.","meta/usr/bin/envctl wrapper receipt; native meta/usr/libexec binary; envctl manifests","Yazelix package input; native envctl profile command; Meta projection update","/home/flexnetos/meta/src/envctl/**; /home/flexnetos/meta/src/yazelix/flake.nix; /home/flexnetos/meta/src/yazelix/packaging/**; /home/flexnetos/meta/usr/bin/envctl; /home/flexnetos/meta/usr/libexec/envctl/**","global package-manager install; user-local envctl wrapper; hand-edited generated runtime","TRUE","envctl-package-cell","command -v envctl resolves under ~/.nix-profile; readlink reaches a native executable; no active envctl route depends on bash/sh/zsh; envctl --version and lock preview pass.","Restore the prior Meta wrapper/projection and remove only the new unselected profile generation.","Draft","proof_records/YZXCONV-006.proof.json","Build envctl from its clean worktree and consume the proven artifact in Yazelix."
"YZXCONV-007","YZXCONV-006; YZXCONV-008","2-foundation","Add preview-first Meta fleet agent-env policy and sync","Meta envctl Fleet Agent","Give the Meta root and every declared src peer an explicit agent-env config or exclusion and drive preview/apply only through Meta and envctl frontdoors.","tasks/meta-envctl-fleet-agent-env-policy; .meta.yaml; envctl peer sync receipt","Meta fleet policy; per-peer result report; reviewed apply receipt","/home/flexnetos/meta/.meta.yaml; /home/flexnetos/meta/agent-env.yaml; /home/flexnetos/meta/agent-env.lock; /home/flexnetos/meta/src/envctl/**; explicitly selected peer agent-env inputs","implicit peer config generation; project .codex/.claude hand edits; apply without approval; generated Yazelix runtime edits","TRUE","meta-fleet-agent-env-cell","Meta-root lock check passes; preview reports every selected peer; reviewed apply has zero broken/failed assets; a second preview is idempotent; exclusions have rationales.","Use envctl's operation receipt to restore affected projections and the prior lock; never roll back unrelated peer commits together.","Draft","proof_records/YZXCONV-007.proof.json","Implement the active Meta GitKB task as a reviewed fleet transaction."
"YZXCONV-008","YZXCONV-002","2-foundation","Codify Meta central control and independent peer mode","Meta Control-Plane Agent","Make meta git and meta exec the fleet frontdoors while preserving local Git, issue, test, release, and commit authority in every peer.","Meta GitKB architecture; .meta.yaml; four repo status receipts","dual-mode contract; command matrix; regression checks","/home/flexnetos/meta/AGENTS.md; /home/flexnetos/meta/docs/**; /home/flexnetos/meta/meta_*; /home/flexnetos/meta/src/*/AGENTS.md","monorepo conversion; cross-repo squashed history; raw fleet mutation outside Meta frontdoors","FALSE","meta-policy-cell","meta git status covers the fleet; meta exec can target the four Yazelix peers; each peer local git status and repo-specific workflow remains functional and independently committable.","Revert only the policy/test commit in its owning repository; peer histories remain untouched.","Draft","proof_records/YZXCONV-008.proof.json","Land the dual-mode contract before fleet sync implementation."
"YZXCONV-009","YZXCONV-002; YZXCONV-003","3-execution","Implement and select RTK TokenKill nu_shell mode","RTK TokenKill Agent","Add a documented native nu_shell configuration mode to rtk-tokenkill and select it in the Yazelix-owned active RTK config.","rtk 0.43.0 config receipt; rtk-tokenkill source; Yazelix Nu contract","rtk nu_shell schema and tests; Yazelix config input; installed proof","/home/flexnetos/meta/src/rtk-tokenkill/**; /home/flexnetos/meta/src/yazelix/nushell/**; /home/flexnetos/meta/src/yazelix/packaging/**; /home/flexnetos/.config/yazelix/**; /home/flexnetos/.config/rtk/config.toml","legacy shell rewrite hook restoration; global cargo install; direct generated-runtime edit","TRUE","rtk-nu-shell-cell","rtk config prints the documented nu_shell selection; native Nu integration tests pass; Codex and Claude commands route through the profile RTK binary without Bash rewrite hooks.","Re-select the prior documented RTK mode and restore its config input; keep the previous profile generation available.","Draft","proof_records/YZXCONV-009.proof.json","Design the rtk config schema in its independent repo, publish it, then pin it in Yazelix."
"YZXCONV-010","YZXCONV-006; YZXCONV-008; YZXCONV-009","3-execution","Complete the Yazelix native Nushell command catalog","Yazelix Nushell Agent","Make yazelix/nushell/config the single interactive command catalog for codex, claude, envctl, meta, grit, icm, weave, nix, bun, bunx, and raw gate escapes.","staged rtk_wrappers.nu; profile command inventory; RTK policy","native Nu modules and externs; package contracts; behavior tests","/home/flexnetos/meta/src/yazelix/nushell/config/**; /home/flexnetos/meta/src/yazelix/nushell/scripts/**; /home/flexnetos/meta/src/yazelix/packaging/**","npm/npx/pnpm as active package owners; generated ~/.local/share/yazelix edits; duplicate host command definitions","TRUE","yazelix-nushell-cell","Nu parses every module; command signatures/argv survive; meta/grit/icm/weave/envctl/nix resolve through profile paths; bun/bunx replace npm/npx/pnpm; caret raw gates remain available.","Remove the new Nu imports/modules and restore the prior packaged config; do not restore user-bin wrappers.","Draft","proof_records/YZXCONV-010.proof.json","Revise the staged wrapper module rather than layering a second command catalog."
"YZXCONV-011","YZXCONV-010","3-execution","Retire or explicitly bridge every legacy Bash POSIX and Zsh route","Shell Boundary Agent","Classify every active shell launcher/wrapper, including the packaged desktop launcher; delete stale ones and make each retained POSIX boundary callable and testable from the Yazelix Nu catalog without alternate ownership.","Yazelix shells/{bash,posix,zsh}; Yazelix packaging/flake_outputs.nix desktop launcher; Meta usr/bin wrappers; Claude hook inventory","shell boundary inventory; desktop launcher migration receipt; deletions; Nu bridge tests; retained-boundary rationale","/home/flexnetos/meta/src/yazelix/shells/**; /home/flexnetos/meta/src/yazelix/nushell/**; /home/flexnetos/meta/src/yazelix/packaging/**; /home/flexnetos/meta/usr/bin/**; owning envctl manifest components","unreviewed deletion of platform bootstrap; shell rewrites outside owner repos; generated runtime hand edits","TRUE","shell-boundary-cell","No stale bash-to-nu or user-local wrapper exists; the profile-owned FlexNetOS Agent desktop entry invokes the profile launcher and profile layout without sh -lc or an alternate shell owner; no active Zsh/Bash command lacks a Nu equivalent; every retained sh boundary uses fixed code plus structured argv and has exact behavior tests.","Restore only a removed boundary whose pre-change behavior receipt proves it is required; never reintroduce an alternate profile owner.","Draft","proof_records/YZXCONV-011.proof.json","Create the inventory from Meta canonical repos, including packaging/flake_outputs.nix, while excluding caches and runner workdirs."
"YZXCONV-012","YZXCONV-008; YZXCONV-010","3-execution","Add Nu surfaces for Meta Grit ICM Weave and canonicalize old flakes","Fleet Nushell Agent","Give Meta, Grit, ICM, Weave, and Nix/flake operations first-party Nu externs/modules and classify duplicate or obsolete flake roots through Meta inventory.","profile command receipts; flake inventory; peer repositories","Nu modules; canonical flake registry; stale-flake retirement plan and proof","/home/flexnetos/meta/src/yazelix/nushell/**; /home/flexnetos/meta/docs/**; /home/flexnetos/meta/src/grit/**; /home/flexnetos/meta/src/icm/**; /home/flexnetos/meta/src/weave/**; canonical flake-owning peer repos","runner _work trees; temporary worktrees; vendored upstream source mutation; deleting Nix generations","TRUE","fleet-nushell-cell","Nu extern/help smoke tests pass for all five command families; Meta inventory labels every flake canonical/vendor/worktree/runner/stale; only approved stale control paths are retired.","Restore retired tracked flake files in their independent repos and remove only the new Nu imports if verification fails.","Draft","proof_records/YZXCONV-012.proof.json","Separate canonical peer flakes from worktree, runner, and vendored copies before editing."
"YZXCONV-013","YZXCONV-002; YZXCONV-008","11-fleet-integration","Verify and pin the four-repository ownership transaction","Yazelix Integration Agent","Ensure main Yazelix consumes reviewed child revisions while Helix, Yazi Assets, and Terminal Support remain independently buildable and narrowly owned.","four GitNexus graphs; child AGENTS.md files; main flake inputs","published child revisions; main lock/pin update; independent build receipts","/home/flexnetos/meta/src/yazelix/**; /home/flexnetos/meta/src/yazelix-helix/**; /home/flexnetos/meta/src/yazelix-yazi-assets/**; /home/flexnetos/meta/src/yazelix-terminal-support/**","cross-repo uncommitted override as final proof; child runtime-policy expansion; monorepo commit","TRUE","four-repo-integration-cell","Each child local gate passes; child commits are published before the main pin; main validation passes without override-input; GitNexus confirms the intended ownership seams.","Revert only the main input pin to the last published child revisions; preserve independently valid child commits.","Draft","proof_records/YZXCONV-013.proof.json","Implement child changes first only where a task proves they are necessary."
"YZXCONV-014","YZXCONV-003; YZXCONV-004; YZXCONV-005; YZXCONV-006; YZXCONV-007; YZXCONV-009; YZXCONV-010; YZXCONV-011; YZXCONV-012; YZXCONV-013","10-runtime-proof","Build install materialize and test the one-profile runtime","Runtime Verification Agent","Prove the complete source-to-profile-to-generated-runtime chain for yzx, the desktop launcher, Nu, RTK, Codex, Claude, envctl, Meta, Grit, ICM, Weave, and terminals.","all prior task proofs; built foundation closure; approved cutover; profile desktop entry and layout","installed runtime receipt; generated config checksums; desktop provenance and stale-shadow receipt; doctor and command evidence","/home/flexnetos/.nix-profile*; /home/flexnetos/.config/yazelix/**; /home/flexnetos/.local/share/yazelix/**; /home/flexnetos/.local/share/applications/**; /home/flexnetos/.codex/config.toml; /home/flexnetos/.codex/RULES.md; /home/flexnetos/.claude/settings.json","auth and secret files; sessions and databases; manual generated-runtime edits; stale user-bin shadows; retaining stale user-local desktop launchers as parallel control paths","TRUE","installed-runtime-cell","Source package checks pass; one profile is selected; the visible FlexNetOS Agent desktop entry launches /home/flexnetos/.nix-profile/bin/yzx with the profile layout override and no stale user-local shadow; yzx doctor/inspect pass; generated Nu loads nu_shell and all command modules; Codex config and RULES.md plus Claude/envctl provenance are correct; Kitty/Ghostty contract passes.","Atomically reselect the prior profile generation, restore config projections from receipts, and restore only the archived desktop entry if required; retain failure logs outside generated runtime.","Draft","proof_records/YZXCONV-014.proof.json","Run build proof before requesting the explicit profile/config/desktop cutover approval."
"YZXCONV-015","YZXCONV-014","11-system-proof-release","Reindex verify and close the convergence graph","Independent Verification Agent","Audit every explicit requirement against current source, installed runtime, fleet state, and independent peer state before declaring completion.","all YZXCONV proofs; installed runtime; four repositories; Meta fleet","final requirement matrix; refreshed GitNexus indexes; clean-state receipts","/home/flexnetos/meta/src/lifeos/planning-spine-v0/yazelix_runtime_convergence/**; four Yazelix .gitnexus indexes; read-only fleet and runtime surfaces","new implementation mutation; unapproved push; deletion of unrelated dirty work; completion with missing proof","FALSE","closure-audit-cell","All YZXCONV task gates have proof; four indexes are current; meta git status and gh open-PR inventory are reconciled; peer local statuses are clean or explicitly attributed; no requirement is missing or indirect.","Reopen the first contradicted task and invalidate dependent proof records; do not paper over the contradiction in the final matrix.","Draft","proof_records/YZXCONV-015.proof.json","Execute only after YZXCONV-014 installed-runtime proof passes."
"YZXCONV-016","LPS-003","0-foundation","Land PR #41 from the owner-approved head without follow-up edits","LifeOS Integration Agent","Preserve the owner-approved PR #41 head byte-for-byte as the merge input; conflict settlement, package restoration, schema repair, task additions, and runtime work must remain separate follow-up tasks and commits.","owner-approved PR #41 head SHA; PR base SHA; GitHub merge metadata; pre-merge branch receipt","as-is merge receipt; approved-head tree comparison; follow-up handoff","/home/flexnetos/meta/src/lifeos/.git/**; /home/flexnetos/meta/src/lifeos/planning-spine-v0/yazelix_runtime_convergence/**","PR branch content rewrite; conflict resolution folded into the PR head; package or canonical graph edits; runtime/profile mutation; unrelated branch cleanup","TRUE","pr41-as-is-landing-cell","The landed merge names the owner-approved PR #41 head, its merged tree is byte-identical to that approved head contribution, and every later reconciliation appears only in dependent tasks and commits.","Revert the merge as one unit without rewriting the approved PR head or mixing follow-up work into the rollback.","Ready","proof_records/YZXCONV-016.proof.json","Capture all conflicts and saved repository state in YZXCONV-017 without applying or disposing of them."
"YZXCONV-017","YZXCONV-016","0-foundation","Inventory conflicts stashes and worktrees without disposition","Repository State Archivist","Record every conflict entry and every saved stash, worktree, branch, and untracked-package object as unresolved owned evidence; do not label it stale, unnecessary, superseded, or safe to delete without an explicit owner decision.","unmerged index stages; stash commit and parents; worktree and branch inventory; untracked package object IDs","immutable reconciliation inventory; ownership and uncertainty fields; owner-decision queue","/home/flexnetos/meta/src/lifeos/planning-spine-v0/yazelix_runtime_convergence/**","stash apply/pop/drop; worktree remove/prune; branch deletion; reset/checkout; conflict resolution; package mutation; inferred stale or unneeded disposition","FALSE","saved-state-evidence-cell","All 44 conflict paths include exact stage/blob provenance; every stash parent, worktree, branch, and untracked package object is recorded; zero saved state is applied, removed, renamed, or dispositioned; every unresolved item names the owner decision required.","Revert only the authored inventory; preserve every Git object, ref, worktree, and saved file exactly as found.","Ready","proof_records/YZXCONV-017.proof.json","Review task and proof compatibility in YZXCONV-018 using the preserved inventory."
"YZXCONV-018","YZXCONV-017","1-schema","Review the focused package against canonical task and proof contracts","Planning Spine Contract Reviewer","Produce a compatibility and integration plan for the focused task graph and proof package without mutating the canonical graph or append-only ledger.","PR #41 task package; preserved package object; canonical task schemas; proof schemas; canonical graph; proof ledger","task-row compatibility report; proof-shape report; ID parent phase and sequence mapping; deterministic integration plan","/home/flexnetos/meta/src/lifeos/planning-spine-v0/yazelix_runtime_convergence/**","canonical task graph mutation; canonical proof ledger append; proof rewriting; product source mutation; runtime/profile mutation","FALSE","task-proof-compatibility-cell","Every focused row and proof is classified against the correct versioned contract; task IDs, parents, phases, collisions, proof revisions, ledger sequence, and hash impact are forecast; canonical graph and ledger bytes remain unchanged.","Remove only the review report and leave the focused package, canonical graph, and ledger unchanged.","Ready","proof_records/YZXCONV-018.proof.json","Present the complete review and proposed follow-up tasks for the owner decision in YZXCONV-019."
"YZXCONV-019","YZXCONV-001; YZXCONV-018","1-schema","Require an explicit owner decision before any execution task","Owner Review Gate","End the review after presenting findings and task additions; a review request does not authorize implementation, cleanup, verification loops, GitHub mutation, or execution of any downstream task.","YZXCONV-001 evidence; YZXCONV-016 through YZXCONV-018 review receipts; reviewed task graph diff","approved or denied execution decision; exact authorized task IDs; frozen next action","/home/flexnetos/meta/src/lifeos/planning-spine-v0/yazelix_runtime_convergence/**","product source; runtime/profile; Git refs or remotes; canonical graph or ledger mutation; cleanup or implementation inferred from review","FALSE","owner-review-boundary-cell","The owner records approve or deny plus the exact authorized task IDs; without that record no downstream Ready task is eligible to execute and every Draft task remains Draft; the review stops without executing, fixing, cleaning, merging, pushing, or verifying those tasks.","Revoke only the decision receipt; all repository and runtime state remains untouched.","Ready","proof_records/YZXCONV-019.proof.json","Stop and wait for the owner's next explicit instruction."
